{
  "SchemaVersion": "1.1",
  "ToolVersion": "3.0.0",
  "HandEdited": false,
  "ReviewedAt": "2026-08-13",
  "CatalogCompleteness": "ReviewedBroadIdentityRulesWithObservedRuntimeBindings",
  "UnknownHardwarePolicy": "ReviewRequired",
  "IdentityOrder": [
    "WindowsPnpHardwareId",
    "WindowsPnpCompatibleId",
    "ReviewedInfModelMatch",
    "PciSubsystemAndRevisionRetainedForEvidenceOnly"
  ],
  "Sources": [
    {
      "id": "amd-npu-check",
      "type": "Published",
      "url": "https://github.com/amd/RyzenAI-SW/blob/main/utilities/npu_check/npu_util.cpp",
      "statement": "AMD npu_check recognizes PCI\\VEN_1022&DEV_1502 as AIE2 and PCI\\VEN_1022&DEV_17F0 as AIE2P."
    },
    {
      "id": "amd-ryzenai-1.7-inst",
      "type": "Published",
      "url": "https://ryzenai.docs.amd.com/en/1.7/inst.html",
      "statement": "AMD quicktest example uses PCI revision hints: 1502 REV_00 => PHX/HPT; 17F0 REV_00/10/11 => STX; 17F0 REV_20 => KRK."
    },
    {
      "id": "linux-amdxdna-npu4",
      "type": "Published",
      "url": "https://github.com/torvalds/linux/blob/master/drivers/accel/amdxdna/npu4_regs.c",
      "statement": "Linux amdxdna refines 17F0/NPU4 by firmware-reported device revision into Strix, Krackan, Strix Halo, and Gorgon Point variants."
    },
    {
      "id": "linux-amdxdna-doc",
      "type": "Published",
      "url": "https://docs.kernel.org/accel/amdxdna/amdnpu.html",
      "statement": "Linux amdxdna documentation describes Phoenix/Hawk Point and Strix Point NPU topologies and the NPU as a PCIe device."
    },
    {
      "id": "windows-ipustack-376-static",
      "type": "StaticDisassemblyProven",
      "artifactSha256": "24f8c7220b86ccb8246845c3dd25f55be4e64b2fac1aab1fbac1e1f8226d4a42",
      "statement": "Exact-hash Windows ipustack.sys 32.00.20101.3760 contains a secondary device-revision refinement mapping values 1..8 to Strix A/B, Krackan 1/2, Strix Halo, and Gorgon Point 1/2/3 display labels; it initializes unknown revision to 9 and contains a dedicated 0x117 command primitive. This independently correlates with upstream amdxdna MSG_OP_GET_DEV_REVISION semantics."
    },
    {
      "id": "observed-z2-runtime-20260813",
      "type": "ObservedRuntimeReviewed",
      "evidenceArchiveSha256": "f10c70ef8a6d1621f36bd1e0ce1e91b915af3a684e7754cff26fb99308d4258e",
      "statement": "Ryzen AI Z2 Extreme observed as PCI 1022:17F0 REV_10; XRT reports NPU Strix firmware 1.1.2.64; installed INF/ipustack/xrt-smi exactly match reviewed AMD 376 payload."
    }
  ],
  "Identities": [
    {
      "identityId": "amd-npu-aie2-1502",
      "vendorId": "1022",
      "deviceId": "1502",
      "amdNpuCheckLabel": "AIE2",
      "architectureFamily": "XDNA1/AIE2",
      "broadCodenames": [
        "Phoenix",
        "Hawk Point"
      ],
      "hardwareIdPattern": "PCI\\VEN_1022&DEV_1502",
      "pciRevisionHints": [
        {
          "revision": "00",
          "codenames": [
            "Phoenix",
            "Hawk Point"
          ],
          "confidence": "PublishedAdvisory",
          "sourceId": "amd-ryzenai-1.7-inst"
        }
      ],
      "firmwareRevisionMap": [],
      "preinstallDiscriminator": "No Phoenix/Hawk Point CPU distinction is required for Windows driver-track selection. Match the complete Windows PnP HardwareID/CompatibleID set against the reviewed INF model; retain SUBSYS and REV as evidence without using them to infer a CPU/NPU combination.",
      "evidenceSourceIds": [
        "amd-npu-check",
        "amd-ryzenai-1.7-inst",
        "linux-amdxdna-doc"
      ]
    },
    {
      "identityId": "amd-npu-aie2p-17f0",
      "vendorId": "1022",
      "deviceId": "17F0",
      "amdNpuCheckLabel": "AIE2P",
      "architectureFamily": "XDNA2/AIE2P-NPU4",
      "broadCodenames": [
        "Strix Point",
        "Krackan Point",
        "Strix Halo",
        "Gorgon Point"
      ],
      "hardwareIdPattern": "PCI\\VEN_1022&DEV_17F0",
      "pciRevisionHints": [
        {
          "revision": "00",
          "codenames": [
            "Strix Point"
          ],
          "confidence": "PublishedAdvisory",
          "sourceId": "amd-ryzenai-1.7-inst"
        },
        {
          "revision": "10",
          "codenames": [
            "Strix Point"
          ],
          "confidence": "PublishedAdvisory",
          "sourceId": "amd-ryzenai-1.7-inst"
        },
        {
          "revision": "11",
          "codenames": [
            "Strix Point"
          ],
          "confidence": "PublishedAdvisory",
          "sourceId": "amd-ryzenai-1.7-inst"
        },
        {
          "revision": "20",
          "codenames": [
            "Krackan Point"
          ],
          "confidence": "PublishedAdvisory",
          "sourceId": "amd-ryzenai-1.7-inst"
        }
      ],
      "firmwareRevisionMap": [
        {
          "value": 1,
          "symbol": "STXA",
          "label": "NPU Strix",
          "codename": "Strix Point"
        },
        {
          "value": 2,
          "symbol": "STXB",
          "label": "NPU Strix",
          "codename": "Strix Point"
        },
        {
          "value": 3,
          "symbol": "KRK1",
          "label": "NPU Krackan 1",
          "codename": "Krackan Point"
        },
        {
          "value": 4,
          "symbol": "KRK2",
          "label": "NPU Krackan 2",
          "codename": "Krackan Point"
        },
        {
          "value": 5,
          "symbol": "HALO",
          "label": "NPU Strix Halo",
          "codename": "Strix Halo"
        },
        {
          "value": 6,
          "symbol": "GPT1",
          "label": "NPU Gorgon Point 1",
          "codename": "Gorgon Point"
        },
        {
          "value": 7,
          "symbol": "GPT2",
          "label": "NPU Gorgon Point 2",
          "codename": "Gorgon Point"
        },
        {
          "value": 8,
          "symbol": "GPT3",
          "label": "NPU Gorgon Point 3",
          "codename": "Gorgon Point"
        }
      ],
      "firmwareRevisionSemantics": "Firmware-reported AIE2 device-revision values, not PCI REV_XX bytes. Linux upstream defines STXA=1, STXB=2, KRK1=3, KRK2=4, HALO=5, GPT1=6, GPT2=7, GPT3=8, UNKN=9 and enables AIE2_GET_DEV_REVISION from firmware 6.24. Exact-hash Windows ipustack.sys 32.00.20101.3760 independently contains the same 1..8 refinement order, unknown default 9, and a dedicated 0x117 command primitive.",
      "preinstallDiscriminator": "PCI DEV 17F0 is sufficient as an INF model input when the complete Windows PnP identity matches the reviewed preferred-production-track INF. CPU SKU, CPU ID, CPU/NPU combination and firmware device revision are not driver-track inputs. Unknown or incomplete PnP identity remains ReviewRequired.",
      "evidenceSourceIds": [
        "amd-npu-check",
        "amd-ryzenai-1.7-inst",
        "linux-amdxdna-npu4",
        "windows-ipustack-376-static",
        "observed-z2-runtime-20260813"
      ],
      "observedRuntimeBindings": [
        {
          "processorId": "ryzen-ai-z2-extreme",
          "processorName": "AMD Ryzen AI Z2 Extreme",
          "pciRevision": "10",
          "subsystemId": "20CF1043",
          "quicktestStyleClassification": "STX",
          "xrtDeviceName": "NPU Strix",
          "xrtFirmwareVersion": "1.1.2.64",
          "firmwareDeviceRevisionStatus": "Unresolved",
          "reviewedArtifactSha256": "aa836cbfcad5d0782c79b58f197aa50624af37e7cb8311c5f94d85b0dc3ccaad",
          "fullObservedStackExactMatch": true,
          "sourceId": "observed-z2-runtime-20260813"
        }
      ]
    }
  ]
}
